ID,DOT,Question,Answer1,Answer2,Answer3,Answer4,CorrectAnswer,Category,Subcategory,Explanation,MustInclude,Difficulty
69,SSA-5.9,What are the potential consequences of serving alcohol to a minor?,Only a warning for first offense,Criminal charges fines and loss of liquor license,Only a civil fine,Nothing if the minor had a fake ID,2,Legal Liability,Minor Service,Serving alcohol to a minor can result in criminal charges substantial fines and revocation of the establishment's liquor license. The fake ID defense provides limited protection.,0,2
70,SSA-5.10,Does having a fake ID fully protect an establishment from liability for serving a minor?,Yes — it transfers all liability to the minor,No — establishments can still face penalties depending on state law,Yes — if the ID appeared genuine,Only if the server checked the ID,2,Legal Liability,Fake ID Defense,While a convincing fake ID may mitigate liability in some states it does not provide complete protection in all jurisdictions. Consistent ID checking practices are the best defense.,0,3
71,SSA-5.11,What is social host liability?,Liability for serving alcohol at a private party,A law about hosting events in restaurants,A requirement to have security at parties,A tax on private events,1,Legal Liability,Social Host Liability,Social host liability laws hold private individuals responsible for injuries caused by guests they served alcohol to. This applies to house parties and private events not just commercial establishments.,0,3
72,SSA-5.12,Why is it important to know your state's specific dram shop laws?,Laws vary significantly by state,They are the same everywhere,Only managers need to know them,They only apply to spirits not beer or wine,1,Legal Liability,State Laws,Dram shop laws vary significantly between states including differences in liability limits defenses available and whether servers can be personally liable.,0,2
73,SSA-5.13,An intoxicated guest injures themselves after leaving your establishment. Can your establishment be liable?,Never — injuries outside the establishment are not your responsibility,Possibly — depending on state law and the circumstances of service,Only if they fall on your property,Only if they were a minor,2,Legal Liability,Liability Scenarios,Some states extend dram shop liability to self-inflicted injuries. The circumstances of service and the guest's visible intoxication at the time of service are key factors.,0,3
74,SSA-5.14,What is the best way to demonstrate that your establishment operates responsibly?,Post signs about responsible drinking,Maintain consistent service standards and training records,Serve food with every drink,Limit hours of operation,2,Legal Liability,Liability Protection,Documented training programs consistent service standards and incident logs demonstrate a culture of responsible service which is critical in legal proceedings.,0,2
75,SSA-5.15,What should an establishment do after an incident involving an intoxicated guest?,Nothing unless someone was hurt,Document the incident thoroughly as soon as possible,Wait to see if a lawsuit is filed,Deny the guest was intoxicated,2,Legal Liability,Incident Documentation,Thorough prompt documentation of incidents is critical. Detailed records created close in time to the event are far more credible than recollections made later.,0,3
76,SSA-6.1,What is the primary goal of responsible alcohol service?,To maximize alcohol sales,To ensure a safe and enjoyable experience for all guests,To meet minimum legal requirements only,To prevent guests from drinking,2,Responsible Service,Core Principles,Responsible alcohol service aims to provide a safe enjoyable environment while preventing harm. It balances hospitality with duty of care.,0,1
77,SSA-6.2,Why is it important to offer food to guests who are drinking?,Food slows alcohol absorption,Food absorbs all the alcohol,Food prevents intoxication entirely,It is not important,1,Responsible Service,Food Service,Food particularly high-protein and high-fat foods slows the absorption of alcohol into the bloodstream helping to moderate the rise in BAC.,0,2
78,SSA-6.3,Which of the following is an example of responsible alcohol service?,Offering a free round of drinks at last call,Encouraging guests to drink more to increase tips,Monitoring guest consumption throughout their visit,Serving doubles to speed up service,3,Responsible Service,Service Practices,Monitoring guest consumption and making proactive service decisions throughout the visit is the cornerstone of responsible service.,0,2
79,SSA-6.4,What does a house policy on alcohol service typically include?,Rules for pricing specials only,Guidelines for responsible service refusal procedures and emergency protocols,Only the hours alcohol is served,Only rules for servers not managers,2,Responsible Service,House Policy,A comprehensive house policy includes responsible service standards refusal procedures emergency protocols and staff training requirements.,0,2
80,SSA-6.5,How should an establishment handle a guest who appears to be pre-intoxicated when they arrive?,Serve them normally since they were not served here,Refuse alcohol service,Offer them only beer,Ask them to leave immediately,2,Responsible Service,Pre-Intoxicated Guests,A guest who arrives already intoxicated should not be served alcohol. Serving them would constitute service to a visibly intoxicated person creating legal liability.,0,2
81,SSA-6.6,What is the role of management in responsible alcohol service?,Only to handle complaints,To train staff set policies and support responsible service decisions,To override server refusals,To handle all service personally,2,Responsible Service,Management Role,Management is responsible for training staff establishing and enforcing responsible service policies and supporting servers when difficult decisions must be made.,0,2
82,SSA-6.7,Why should servers avoid drinking alcohol while on duty?,It is a personal choice,It impairs their ability to assess guests and make responsible service decisions,Only bartenders should avoid it,It only matters if they drink heavily,2,Responsible Service,Server Conduct,A server who has consumed alcohol cannot reliably assess a guest's intoxication level and may make poor service decisions. Most establishments prohibit staff from drinking on duty.,0,2
83,SSA-6.8,What is the purpose of a last call procedure?,To maximize last-minute sales,To give guests a chance to order one final drink while managing their departure responsibly,To close the bar as fast as possible,To collect all glasses,2,Responsible Service,Last Call,A responsible last call procedure gives guests reasonable notice while allowing staff to monitor the final round of service and arrange safe transportation if needed.,0,2
84,SSA-6.9,What should a server do if they see a coworker over-serving a guest?,Ignore it — it is not their responsibility,Inform a manager,Confront the coworker publicly,Continue serving the guest themselves,2,Responsible Service,Team Responsibility,Responsible service is a team effort. If you see a coworker over-serving a guest notify a manager. The establishment's liability and the guest's safety are everyone's concern.,0,2
85,SSA-6.10,How does offering water to guests support responsible service?,It replaces alcohol consumption,It slows alcohol absorption and paces consumption,It has no effect on intoxication,It is only helpful before drinking starts,2,Responsible Service,Service Practices,Offering water between drinks slows consumption and helps maintain hydration. It is a non-confrontational way to pace a guest's drinking.,0,2
86,SSA-6.11,What is the benefit of a two-drink maximum per round policy?,It limits revenue,It prevents guests from becoming intoxicated as quickly,It is required by law,It only applies to spirits,2,Responsible Service,Service Policies,Limiting orders to two drinks per round slows consumption rates giving the server more opportunity to monitor the guest's condition between rounds.,0,3
87,SSA-6.12,Which of the following promotes responsible alcohol service?,Happy hour specials with unlimited drinks,Drink specials that reward faster consumption,Clear pricing visible non-alcoholic options and attentive service,Serving alcohol until closing without monitoring,3,Responsible Service,Responsible Promotions,Responsible promotions avoid incentivizing rapid consumption. Clear pricing visible non-alcoholic alternatives and attentive service support a responsible service environment.,0,2
88,SSA-6.13,What should be included in responsible service training for staff?,Only how to make cocktails,Legal requirements signs of intoxication refusal procedures and house policy,Only how to check IDs,Only how to handle customer complaints,2,Responsible Service,Staff Training,Comprehensive responsible service training covers legal requirements recognizing intoxication intervention techniques refusal procedures and establishment-specific policies.,0,2
89,SSA-6.14,Why is consistency important in responsible alcohol service?,It makes scheduling easier,Consistent practices ensure all guests are treated fairly and protect the establishment legally,It speeds up service,It only matters for compliance audits,2,Responsible Service,Consistency,Inconsistent service practices create both fairness issues and legal vulnerabilities. Consistent application of responsible service standards protects guests and the establishment.,0,2
90,SSA-6.15,What is the server's responsibility when a guest orders alcohol for someone who appears intoxicated?,Serve the order since they did not order it themselves,Refuse the alcohol regardless of who ordered it,Serve beer but not spirits,Ask the manager to decide,2,Responsible Service,Third Party Orders,Your responsibility is to the intoxicated guest's safety not to the convenience of their table. Refusing alcohol to an intoxicated person applies regardless of who places the order.,0,3
91,SSA-1.16,A guest presents a valid ID but appears to be much younger than the photo. What should you do?,Accept the ID since it is valid,Ask for a second form of ID and observe carefully,Refuse service without explanation,Ask another server to check,2,ID Verification,ID Comparison,If there is a significant discrepancy between the guest's appearance and the photo ask for additional ID. A valid ID with a suspicious photo match warrants extra verification.,0,3
92,SSA-1.17,What is the minimum age at which a server can legally check IDs and serve alcohol in most states?,16,18,21,There is no minimum,2,ID Verification,Server Age Requirements,Most states require alcohol servers to be at least 18 years old. Some require 21. Always check your state's specific requirements.,0,2
93,SSA-2.16,A guest says they are a nurse and can handle more alcohol than usual. Should this affect your service decision?,Yes — medical professionals can handle more,No — observable behavior is your guide,Yes — if they show their credentials,Only if they are off duty,2,Signs of Intoxication,Assessment,Professional claims do not affect your service decision. Your assessment must be based on observable signs of intoxication not on the guest's stated tolerance or profession.,0,3
94,SSA-2.17,Which sense is often most reliable when assessing a guest's intoxication?,Hearing their speech,Smelling alcohol on their breath,Watching their behavior and coordination,Touching their arm,3,Signs of Intoxication,Assessment,Behavioral observation including coordination speech clarity and demeanor is the most reliable and professionally appropriate method of assessing intoxication.,0,3
95,SSA-3.16,Does drinking water between alcoholic drinks lower a person's BAC?,Yes — water dilutes the alcohol,No — water does not affect BAC,Yes — but only if they drink equal amounts,Only if combined with food,2,BAC & Physiology,Myths,Water does not lower BAC. It can help with hydration and may slow consumption but it does not speed up the elimination of alcohol from the bloodstream.,0,2
96,SSA-3.17,How does age affect alcohol metabolism?,Older adults metabolize alcohol faster,Age has no effect,Older adults metabolize alcohol more slowly,Only affects people over 70,3,BAC & Physiology,BAC Factors,As people age their body water decreases and liver function slows resulting in higher BAC from the same amount of alcohol compared to younger adults.,0,3
97,SSA-4.16,A guest has been nursing the same drink for an hour and shows no signs of intoxication. How should you approach their next order?,Offer a stronger drink since they are clearly fine,Serve them normally while continuing to monitor,Refuse service as a precaution,Ask them if they plan to drive,2,Intervention & Refusal,Ongoing Assessment,A guest who is pacing themselves and showing no signs of intoxication should be served normally. Responsible service does not mean refusing all service only refusing when signs warrant it.,0,2
98,SSA-4.17,What should you do if a guest becomes ill or loses consciousness in your establishment?,Call their friends,Call emergency services immediately,Ask them to leave,Wait to see if they recover,2,Intervention & Refusal,Emergency Response,A guest who loses consciousness or becomes severely ill requires immediate emergency medical assistance. Call 911 without delay.,0,3
99,SSA-5.16,Can an establishment be held liable if they did not know the guest was intoxicated?,Generally no if they exercised reasonable care,Yes always,No never,Only if the guest drove,1,Legal Liability,Liability Defense,Reasonable care — including consistent ID checking monitoring and documentation — provides a defense against liability claims. Establishments are generally not liable when they exercised proper care.,0,3
100,SSA-5.17,What is the significance of a guest's BAC level in a dram shop case?,BAC is irrelevant,High BAC at the time of an incident can support a claim that the guest was visibly intoxicated when served,Only matters if over 0.15%,BAC cannot be used as evidence,2,Legal Liability,BAC and Liability,BAC evidence taken after an incident can be used to retroactively estimate the guest's level of intoxication at the time they were served providing evidence in liability cases.,0,3
101,SSA-6.16,What is the purpose of non-alcoholic beverage options on a menu?,Purely decorative,To provide alternatives for guests who are not drinking or slowing down,Only for designated drivers,Required by law,2,Responsible Service,Non-Alcoholic Options,Visible non-alcoholic options make it easier for guests to switch without feeling singled out and support a responsible service environment.,0,2
102,SSA-6.17,How should an establishment handle a situation where a large group is becoming collectively intoxicated?,Continue serving since no individual is visibly intoxicated,Alert management and consider slowing or stopping service to the group,Serve only beer to the group,Ask the group to leave,2,Responsible Service,Group Management,Groups can collectively encourage higher consumption. When a group is becoming intoxicated alert management and consider service strategies for the group as a whole.,0,3
103,SSA-1.18,A guest presents a vertical ID which typically indicates they were under 21 when it was issued. What should you check?,Nothing — vertical IDs are always for minors,Whether the birthdate makes them currently 21 or older,Refuse service — all vertical IDs mean the person is under 21,Ask for a different ID,2,ID Verification,Vertical ID,Many states issue vertical IDs to people under 21. However the person may now be of legal age. Calculate their current age from the birthdate rather than assuming.,0,3
104,SSA-2.18,A guest who appeared sober an hour ago is now showing signs of intoxication. What does this tell you?,They brought their own alcohol,Their intoxication level has increased and service decisions need to be reassessed,They are faking,Nothing — people's moods change,2,Signs of Intoxication,Ongoing Monitoring,Intoxication develops over time. A guest who was sober earlier may now be impaired. Ongoing monitoring allows you to catch these changes and respond appropriately.,0,2
105,SSA-3.18,A 120-pound woman and a 200-pound man drink the same number of drinks in the same time. Who will likely have the higher BAC?,The man,They will be equal,The woman,It depends on the type of drink,3,BAC & Physiology,BAC Factors,Body weight significantly affects BAC. A lighter person will have less body water to dilute the alcohol resulting in a higher BAC from the same amount consumed.,0,2
106,SSA-4.18,A guest refuses to give up their keys. What is the most appropriate next step?,Force them to hand over the keys,Call law enforcement,Accept that you cannot stop them,Ask another guest to distract them,2,Intervention & Refusal,Drunk Driving Prevention,You cannot physically restrain a guest. However calling law enforcement is appropriate when a guest who is intoxicated intends to drive.,0,3
107,SSA-5.18,Which of the following is an example of negligent alcohol service?,Refusing service to a visibly intoxicated guest,Checking IDs consistently,Continuing to serve a guest who is visibly intoxicated,Offering food to guests who are drinking,3,Legal Liability,Negligent Service,Continuing to serve a visibly intoxicated guest is the definition of negligent alcohol service and is the basis of most dram shop liability claims.,0,2
108,SSA-6.18,What is a reasonable accommodation for a guest who has been refused service?,Offer to call a cab and provide water,Ask them to leave immediately,Ignore them,Offer a non-alcoholic drink and engage them in conversation,4,Responsible Service,Post-Refusal Care,After refusing service continuing to provide hospitality through non-alcoholic beverages and conversation keeps the guest comfortable and reduces the risk of confrontation.,0,2
109,SSA-1.19,A guest presents a temporary paper driver's license. Should you accept it?,Never — only accept plastic IDs,Yes if it is government-issued and includes a birthdate and photo,Only if they also have a second ID,Only for beer not spirits,2,ID Verification,Temporary ID,Temporary paper licenses are issued by the DMV and are valid government documents. They should include necessary information to verify age.,0,2
110,SSA-2.19,Why might a guest who appears sober still be dangerously intoxicated?,They are pretending to be sober,Their tolerance allows them to mask signs of impairment,They had food earlier,They are naturally uncoordinated,2,Signs of Intoxication,Tolerance,High tolerance allows some people to appear sober at BAC levels that would visibly impair others. This makes them just as dangerous — especially behind the wheel.,0,3
111,SSA-3.19,How long after the last drink does BAC typically peak?,Immediately,30 to 90 minutes,3 hours,6 hours,2,BAC & Physiology,BAC Peak,BAC typically peaks 30 to 90 minutes after the last drink depending on food intake and other factors. This means a guest may continue to become more impaired after stopping drinking.,0,3
112,SSA-4.19,What is a common mistake servers make when trying to avoid conflict during a refusal?,Being too direct,Being vague and giving inconsistent messages,Involving management,Offering alternatives,2,Intervention & Refusal,Refusal Techniques,Vague messaging such as maybe just one more sends mixed signals. Clear consistent communication is essential for an effective refusal.,0,3
113,SSA-5.19,What does visible intoxication mean in a legal context?,The guest has a BAC of 0.08% or higher,Observable signs of intoxication that a reasonable person would recognize,The guest is unconscious,The guest has slurred speech only,2,Legal Liability,Legal Definitions,Visible intoxication is a legal standard based on observable signs. Courts will assess whether a reasonable server would have recognized the signs of intoxication based on the guest's behavior.,0,3
114,SSA-6.19,How does consistent responsible service training benefit an establishment?,It increases paperwork,It reduces legal risk ensures consistent service and creates a safer environment,It reduces staff morale,It is only required once,2,Responsible Service,Training Benefits,Regular training ensures all staff apply the same standards reduces legal exposure improves the guest experience and creates a culture of responsibility.,0,2
115,SSA-1.20,What should you do if the ID scanner shows a valid result but the photo does not match the guest?,Trust the scanner and serve the guest,Verify manually — the scanner validates the ID not the identity,Confiscate the ID,Call the police,2,ID Verification,Technology Limits,ID scanners verify that an ID is technically valid but cannot confirm that the person using it is the ID's legitimate owner. Visual verification of the photo is always required.,0,3
116,SSA-2.20,A guest is crying and appears emotionally upset. Could this affect your service decision?,No — emotions are not related to intoxication,Possibly — alcohol amplifies emotions and emotional distress can interact with intoxication,Only if they ask for more drinks,No — serve them as normal,2,Signs of Intoxication,Special Circumstances,Emotional distress combined with alcohol can escalate quickly. A guest who is both upset and intoxicated warrants closer monitoring and potentially slowed service.,0,3
117,SSA-3.20,What happens to BAC when a person stops drinking?,It immediately drops to zero,It continues to rise for a period before declining,It stays constant,It drops at the same rate alcohol was consumed,2,BAC & Physiology,BAC Curve,BAC continues to rise after the last drink until all alcohol has been absorbed typically 30 to 90 minutes. Then it declines at approximately one standard drink per hour.,0,3
118,SSA-4.20,Why is it important to stay calm when refusing service?,It shows you do not care,Calm communication is more effective and reduces the risk of escalation,It is required by law,It protects you from being blamed,2,Intervention & Refusal,Communication Skills,Calm professional communication reduces the chance of confrontation and keeps the interaction focused on safety rather than conflict.,0,2
119,SSA-5.20,Which of the following could increase an establishment's liability in a dram shop case?,Consistent ID checking,Refusing service to visibly intoxicated guests,Serving a guest who later reported feeling fine,Continuing service after a guest showed clear signs of intoxication,4,Legal Liability,Liability Factors,Continuing to serve a guest who has shown clear signs of intoxication is direct evidence of negligent service and significantly increases liability exposure.,0,3
120,SSA-6.20,What is the most important thing a server can do to protect themselves and their establishment?,Memorize drink recipes,Apply responsible service standards consistently every shift,Avoid serving alcohol entirely,Only work day shifts,2,Responsible Service,Server Responsibility,Consistent application of responsible service standards on every shift is the most effective protection for both the server personally and the establishment legally.,0,2
121,SSA-1.21,What is the purpose of checking the expiration date on an ID?,To ensure the ID was recently issued,To confirm the ID is currently valid and has not been altered,To verify the guest's address,To determine how long they have been of legal age,2,ID Verification,Expiration Date,An expired ID is no longer a valid government document and cannot be used for age verification. Checking the expiration date is a standard step in ID verification.,0,1
122,SSA-2.21,A guest's speech is slightly slurred but they insist they only had one drink. What should you do?,Believe them and continue service,Continue monitoring closely and consider slowing service,Immediately refuse service,Ask to see a receipt from another bar,2,Signs of Intoxication,Conflicting Information,Observable signs take priority over a guest's claims about how much they have consumed. Slurred speech is a sign of impairment regardless of what the guest reports.,0,2
123,SSA-3.21,How does drinking rate affect BAC?,Faster drinking means lower BAC,Faster drinking means higher BAC because the liver cannot keep pace,Drinking rate has no effect,Only matters for spirits not beer,2,BAC & Physiology,Drinking Rate,When alcohol is consumed faster than the liver can process it BAC rises more quickly. The liver's processing rate is fixed at approximately one standard drink per hour.,0,2
124,SSA-4.21,A manager tells you to serve a guest you believe is intoxicated. What should you do?,Follow the manager's instruction,Express your concern and ask the manager to assess the guest themselves,Serve the guest to avoid conflict,Quit your job,2,Intervention & Refusal,Manager Conflicts,You are personally responsible for your service decisions. Express your professional concern clearly and ask the manager to personally evaluate the guest before proceeding.,0,3
125,SSA-5.21,What is the significance of having written responsible service policies in an establishment?,They are required by law in all states,They demonstrate a commitment to responsible service and provide operational guidelines,They only matter during an inspection,They protect management but not servers,2,Legal Liability,Written Policies,Written policies demonstrate a systematic commitment to responsible service. They provide clear guidance to staff and serve as evidence of responsible practices in legal proceedings.,0,2
126,SSA-6.21,How does the physical layout of an establishment affect responsible service?,It has no effect,Good visibility of all guests allows staff to monitor consumption and behavior more effectively,Only matters for security,It only affects fire safety,2,Responsible Service,Establishment Design,An establishment designed so that servers have clear sightlines to all guests makes it much easier to monitor consumption and identify guests who may need intervention.,0,3
